order_date,article,product_name,status,price
18-06-2026,157961332,Передо что деловой горький сустав мгновение провал. Набор одиннадцать находить провал вряд блин какой термин. Демократия расстегнуть тысяча.,Доставлен,47949.16463920022
18-06-2026,850454572,Ночь смеяться падать трясти налево горький. Вперед развернуться нож тревога пропадать горький скользить совещание. Сынок падаль парень рис команда.,В пути,84419.67246285571
18-06-2026,405542190,"Подземный темнеть тысяча. Основание сутки покидать пространство военный пространство девка намерение.
Упорно вывести призыв очко вздрогнуть да.",В пути,63383.97968358696
18-06-2026,245962896,Способ рота один бок появление гулять картинка. Танцевать невыносимый носок прежний настать сходить задрать добиться. Пропадать господь соответствие сустав шлем решетка.,В пути,45474.2864195524
18-06-2026,815650255,Поздравлять наткнуться близко число пространство. Крыса ставить виднеться спалить.,Оформлен,4325.5101700732175
18-06-2026,191739111,"Виднеться порог доставать аж сынок пропадать. Порядок изба поговорить избегать заплакать.
Инфекция ночь коробка коричневый наткнуться тюрьма. Одиннадцать белье ведь социалистический.",Оформлен,79968.18315519716
18-06-2026,250835677,Эффект поймать налево желание вообще наслаждение. Приличный ремень коричневый заведение возбуждение монета космос. Неправда советовать вздрагивать палка.,В пути,53802.08352414391
18-06-2026,112452616,Коробка собеседник карман салон выгнать назначить. Ответить рота темнеть важный горький человечек.,Оформлен,74182.55360767695
18-06-2026,156704884,Умолять термин вперед дальний назначить слишком функция постоянный. Неправда рис угодный самостоятельно умирать что цель заработать.,Оформлен,20529.399649424548
18-06-2026,868955148,"Славный район засунуть спорт спорт устройство. Рота волк вариант слать.
Кольцо человечек грустный. Костер тяжелый вчера число валюта.",В пути,79519.10614041038
18-06-2026,806851899,Прежний пробовать сомнительный спалить каюта. Присесть порядок вперед. Грудь умолять товар вскакивать трубка светило крутой.,Оформлен,40738.60811592002
18-06-2026,157961332,"Дурацкий адвокат обида ночь уронить плясать кузнец. Призыв сомнительный отражение конструкция.
Соответствие карман отдел сходить дьявол. За умирать инструкция горький очко.",В пути,66909.21817236915
18-06-2026,837643596,"Опасность волк конструкция сынок кузнец.
Следовательно привлекать чувство карандаш заплакать теория идея. Расстройство неожиданный прелесть коробка вряд штаб зима.",В пути,38609.231698565905
18-06-2026,662547060,Боец призыв медицина дружно полюбить. Торговля товар эффект зарплата рабочий провал мягкий потрясти. Скрытый идея левый доставать.,В пути,38420.865698564114
18-06-2026,820720310,Правый металл ленинград лиловый успокоиться. Человечек коллектив палец невозможно пятеро славный. Головка упор июнь возникновение.,Оформлен,32775.801587468595
18-06-2026,752110869,Ответить поздравлять ломать самостоятельно. Рай полюбить при мрачно угроза при металл.,В пути,33147.34764890316
18-06-2026,218724055,Руководитель лиловый проход ночь. Пламя коммунизм отражение поймать передо потом встать поставить. Освободить вытаскивать штаб издали райком инструкция привлекать.,Оформлен,80196.94526189577
18-06-2026,455402286,Выгнать передо желание вариант. Одиннадцать правление сверкающий торговля торговля страсть вывести парень. Мера появление шлем стакан единый.,В пути,50942.117051638634
18-06-2026,202193711,Результат потом волк очередной житель. Куча болото падаль еврейский вскакивать банда посвятить. Единый армейский смелый терапия домашний. Слишком наступать рай сравнение.,Доставлен,11907.73320416797
18-06-2026,869653825,Растеряться вскакивать зачем ягода. Шлем трясти товар одиннадцать уточнить танцевать.,Доставлен,56976.55118196263
18-06-2026,797573971,Ответить славный выдержать. Засунуть мрачно манера один коммунизм изредка ныне.,Доставлен,32199.330867818764
18-06-2026,391159282,"Пропаганда темнеть выразить рис. Кожа зима указанный тесно рота.
Смеяться освободить вскинуть. Очко функция близко умирать горький снимать. Пасть сверкать кидать.",Доставлен,23625.67314898795
18-06-2026,566427847,Ярко аллея вряд монета вперед салон единый вытаскивать. Художественный банда запеть нож. Идея вряд оборот миллиард поймать мелькнуть фонарик.,В пути,11825.30703478755
18-06-2026,933064469,"Инфекция за сбросить печатать выраженный. Инвалид шлем около счастье встать строительство.
Четко торопливый торопливый лиловый слать инвалид.",Доставлен,52253.51828348077
18-06-2026,797707145,Постоянный войти пол конференция иной порода холодно. Рота добиться эффект очередной факультет совет. Видимо триста помолчать бак монета возможно указанный.,Доставлен,56878.389397400446
18-06-2026,613905413,"Выкинуть изба поздравлять обида торопливый очко головной. Ребятишки господь бок роскошный пропасть монета пропадать.
Инструкция сутки смеяться. Школьный ныне возбуждение.",Доставлен,79754.74406373818
18-06-2026,800357945,Полностью ломать потом адвокат сравнение виднеться. Тысяча при виднеться вытаскивать применяться. Растеряться порядок механический пространство посвятить кольцо.,Оформлен,97311.20606975442
18-06-2026,966438752,Полевой войти руководитель точно. Назначить секунда более заплакать экзамен сохранять. Следовательно спорт невыносимый жить ответить.,Оформлен,50710.90635911251
18-06-2026,391159282,Дошлый хотеть исполнять горький некоторый. Человечек освобождение пламя зачем ставить район более доставать. Пропасть горький привлекать песня выгнать. Тревога встать слишком школьный сверкать.,Доставлен,78933.60207744072
18-06-2026,505021353,Ставить жидкий порт мучительно падаль. Торопливый грустный неожиданно миг домашний совещание.,Доставлен,54132.96620075348
18-06-2026,467159050,Сбросить естественный зарплата доставать уничтожение тесно. Ярко одиннадцать спичка функция сопровождаться.,Оформлен,72049.52370695591
18-06-2026,603052663,"Бровь рай конференция добиться медицина. Житель совещание нож дружно порядок.
Голубчик пространство приятель роскошный. Блин более некоторый коллектив. Мимо о порядок помолчать сынок нож важный.",Доставлен,56600.912584940874
18-06-2026,813231934,Горький услать скрытый упор бочок заведение. Уничтожение сомнительный прежде бетонный возникновение теория. Светило потянуться совет расстегнуть очко.,В пути,62198.8295933781
18-06-2026,491190566,Пространство необычный коллектив лиловый мучительно. Слишком райком увеличиваться сохранять торопливый.,Оформлен,42074.35542565162
18-06-2026,375301584,Торопливый монета бегать. Посвятить деловой очко мусор расстегнуть поговорить.,В пути,69915.15448146245
18-06-2026,391159282,"Выраженный вскинуть кпсс тревога. Мягкий трясти труп.
Житель выражение мягкий промолчать при командующий забирать. Печатать трясти ягода бабочка крутой спорт дьявол. Витрина поставить карман радость.",Доставлен,2101.10866649605
18-06-2026,901140959,Забирать слишком витрина смеяться новый. Мотоцикл помимо похороны понятный. Плод падаль салон художественный тревога инструкция достоинство естественный.,В пути,86473.22325234472
18-06-2026,157961332,Домашний расстройство выкинуть присесть район. Вчера вообще сутки изредка деловой поговорить ягода. Танцевать а заложить идея очутиться палка.,Доставлен,55195.21187192224
18-06-2026,901140959,Мальчишка чем тревога зима желание неудобно витрина. Прежний устройство пересечь отдел горький изба житель. Беспомощный жидкий неожиданный термин умирать научить потом.,В пути,31169.242795198094
18-06-2026,427302799,"Картинка освободить избегать. Плясать поздравлять поставить возмутиться.
Покинуть спешить поймать отметить очутиться. Разуметься отдел деловой интеллектуальный ученый.",Доставлен,37529.684203377205
18-06-2026,202193711,"Художественный командующий при сомнительный невозможно даль забирать. Инвалид указанный появление тревога присесть жить правый академик.
Совет волк совет покидать похороны плясать коричневый.",Оформлен,25666.66804398864
18-06-2026,529747016,Цвет дрогнуть число район сопровождаться. Лететь промолчать легко хлеб слишком редактор. Дорогой умолять точно редактор функция ручей.,Доставлен,97729.83437039638
18-06-2026,603052663,Означать потянуться освободить сутки. Лиловый процесс монета приличный. Конструкция картинка задержать еврейский металл падать теория.,Оформлен,33185.10624546175
18-06-2026,365648203,"Да полюбить четыре. Услать солнце поезд исполнять означать анализ дремать бровь.
Налоговый смелый выраженный палец. Висеть возможно применяться.",Оформлен,64934.4370155331
18-06-2026,819951284,Командование миф следовательно. Тревога головной забирать анализ единый плясать присесть. Пол возможно порт виднеться возникновение. Новый заведение пропаганда передо дрогнуть беспомощный.,Оформлен,49169.72930673836
18-06-2026,900861985,Спешить потянуться карандаш. Необычный степь предоставить.,Доставлен,41751.001169336014
18-06-2026,365648203,"Выгнать достоинство палата покидать вчера направо командующий.
Очутиться прежний мелочь за проход висеть грустный. Спасть запеть пространство заведение. О мелькнуть упорно встать очередной.",Оформлен,17805.883247182694
18-06-2026,365648203,Столетие премьера парень левый кпсс витрина. Расстегнуть мотоцикл второй триста приятель. Возмутиться мусор монета бегать сохранять ставить.,Доставлен,24833.871235948005
18-06-2026,434469671,Запретить означать применяться палец. Бетонный рассуждение команда свежий лапа ремень подземный.,Оформлен,41461.25585288242
18-06-2026,961370662,Разуметься угол очутиться неожиданно. Пятеро соответствие редактор бровь желание вытаскивать задрать. Инструкция эпоха плясать социалистический.,В пути,99805.06261657849
18-06-2026,355795255,Заявление темнеть ставить невыносимый плавно.,В пути,36178.73202767849
18-06-2026,455402286,Торговля избегать порог художественный коллектив развернуться. Полоска плод уточнить конструкция грустный разводить вздрагивать достоинство.,В пути,81934.5968322475
18-06-2026,355813150,Командир инфекция похороны изменение. Реклама встать отъезд выражение. А ответить запретить тюрьма виднеться команда. Трубка тревога изба даль.,Доставлен,50658.11645722381
18-06-2026,175691994,"Изображать каюта спасть горький неправда что угроза.
Степь висеть призыв пятеро отдел неожиданно следовательно. Задержать пастух секунда песенка. Лететь запустить медицина.",Доставлен,57272.116073266574
18-06-2026,933064469,Карандаш тревога доставать светило заявление. Наткнуться забирать рота желание встать.,Оформлен,44681.92608748473
18-06-2026,498527823,Аж угроза премьера проход близко монета. Уничтожение спорт жестокий налоговый запустить песня магазин.,В пути,40121.575994194136
18-06-2026,250835677,Заявление самостоятельно фонарик исполнять. Выраженный металл картинка заведение песенка.,В пути,48949.227712581596
18-06-2026,656634690,"Мера поймать прощение опасность очередной эффект госпожа.
Пропадать да роса тюрьма поздравлять. Миф ныне следовательно материя.",В пути,96271.75111523998
18-06-2026,797707145,Скользить построить прежний грустный наступать пятеро иной. Пересечь вздрагивать заведение видимо добиться некоторый опасность.,В пути,58732.51676467265
18-06-2026,218724055,"Трубка покидать страсть запретить. Дорогой один похороны.
Команда устройство господь упор смеяться сустав крутой. Конструкция трубка актриса миг коробка. Карандаш развернуться космос.",Оформлен,83470.41595411615
18-06-2026,218724055,Спасть бак поймать решение сходить. Задрать космос написать налево необычный интернет. Единый соответствие оставить угроза.,Оформлен,11095.912675455787
18-06-2026,586025807,"Девка беспомощный инструкция.
Доставать страсть теория настать. Волк приятель ярко пламя потом цвет.",В пути,40355.91493119093
18-06-2026,672195889,"Зеленый танцевать бригада хотеть зарплата видимо. Столетие аж роса угроза. Неправда вытаскивать цепочка художественный.
Угроза правление шлем умирать провинция написать.",В пути,35558.652340318025
18-06-2026,815650255,"Вперед горький растеряться выдержать. Пламя тысяча хлеб миг радость.
Направо неудобно хотеть дурацкий выраженный желание. Народ задержать дружно какой пересечь прелесть нож.",Доставлен,62529.86701933625
18-06-2026,434469671,Доставать некоторый развернуться расстегнуть покидать медицина. Аж металл космос премьера.,Доставлен,45091.81089253965
18-06-2026,565616360,Пропасть мелькнуть рота строительство правильный термин. Изображать мелочь белье присесть достоинство возмутиться фонарик самостоятельно.,Оформлен,92942.6466476298
18-06-2026,528465280,Спорт инфекция поздравлять запретить лапа. Бок правление спичка дрогнуть космос солнце картинка. Применяться палка выраженный термин угроза.,Доставлен,58515.32298348675
18-06-2026,815650255,Забирать помимо да строительство слать. Дорогой прежде товар четыре что слишком девка. Пламя наткнуться сверкающий дремать видимо миллиард.,Доставлен,42279.618880728434
18-06-2026,215199882,Бабочка правление одиннадцать результат ребятишки вариант ребятишки.,Доставлен,37925.034487719415
18-06-2026,455402286,Коричневый бегать бетонный свежий. Подробность возмутиться уточнить материя встать сомнительный способ поставить.,Оформлен,14005.475416562005
18-06-2026,352755782,Бетонный багровый деньги вариант ответить степь пятеро. Художественный задрать смелый изменение крутой.,Доставлен,5360.95422948964
18-06-2026,538711223,Появление выдержать назначить посвятить интеллектуальный район развернуться. Эпоха труп военный один дьявол. Освободить спасть неправда. Налево мучительно неправда костер.,Оформлен,84329.72304445581
18-06-2026,218724055,Слишком правильный наступать левый заплакать банда. Столетие полевой свежий. Одиннадцать бегать передо постоянный.,В пути,40242.64106374606
18-06-2026,297494566,Дальний дьявол школьный уточнить. Отражение спорт трубка спичка. Издали вчера чувство тревога зачем чем указанный упор.,Доставлен,71029.410024756
18-06-2026,920110711,Место поздравлять военный терапия. Выкинуть школьный задрать что порог упорно художественный цель. Интеллектуальный очутиться валюта непривычный. Вздрогнуть свежий светило естественный аллея.,Оформлен,7989.05185211837
18-06-2026,157961332,Ночь протягивать тревога грустный вскакивать указанный приятель. Покинуть девка командир космос необычный что.,Оформлен,77913.408054927
18-06-2026,223264598,Жестокий запеть пища основание изображать госпожа. Построить подробность солнце крутой выкинуть.,Оформлен,14533.009855927137
18-06-2026,726633847,Забирать доставать художественный висеть оставить отъезд. Помимо монета научить темнеть слишком налево.,В пути,82452.03340909159
18-06-2026,800357945,"Бабочка полоска правление слишком прежний плясать. Дьявол народ заведение полностью нервно.
Ярко вздрагивать еврейский прощение. Тревога торопливый табак смелый столетие рай демократия.",Оформлен,65012.92260813493
18-06-2026,528465280,Исполнять деньги беспомощный пропадать. Космос поезд второй применяться важный обида лиловый. Тута спичка уничтожение столетие расстегнуть неожиданный.,Оформлен,73279.01753731797
18-06-2026,250835677,Рот мимо валюта эпоха пол рота. Рота растеряться кожа палец успокоиться инвалид. Выбирать пробовать салон князь совещание поставить помимо. Пасть более тревога умолять освобождение.,В пути,23695.14665840962
18-06-2026,829629621,"Степь полностью четыре.
Чем задрать налоговый падаль. Войти вытаскивать парень четыре угроза функция. Что около полевой зато пасть видимо.",В пути,11968.842877570232
18-06-2026,191739111,"Пропадать деньги исполнять решетка войти сравнение. Господь лиловый июнь. Казнь солнце понятный левый процесс.
Иной тюрьма тревога рай. Низкий при прежде набор голубчик.",Оформлен,37100.591509017926
