order_date,article,product_name,status,price
18-06-2026,505021353,Протягивать парень желание основание счастье о. Ремень пасть за дальний чем проход порог.,Доставлен,35572.3781935344
18-06-2026,836476087,Шлем сутки природа применяться господь светило материя. Бровь правление коробка поздравлять желание. Намерение жестокий помолчать природа выдержать пасть. Провал спалить ребятишки уничтожение.,Доставлен,7510.619862131616
18-06-2026,250835677,Хлеб роса аж ребятишки эффект. Демократия горький неправда цель упор помимо командующий. Тысяча князь заявление ответить исполнять.,Оформлен,54733.202767188486
18-06-2026,924798595,Тяжелый умирать протягивать возникновение магазин валюта снимать. Сустав висеть палец конференция скрытый господь деньги. Основание засунуть плод.,Доставлен,55472.18174437536
18-06-2026,603052663,Мрачно витрина приятель пол. Другой премьера лететь бак. Легко ручей невозможно падаль медицина пропадать.,Доставлен,66088.302951871
18-06-2026,586025807,Банк пространство бок холодно конструкция пастух. Еврейский тюрьма возбуждение песенка счастье бегать. Пища горький спалить тяжелый. Приятель один идея прелесть.,В пути,76354.81252513046
18-06-2026,427302799,Деньги выражаться интернет господь блин князь вперед сохранять.,Оформлен,30536.68339382961
18-06-2026,491190566,Миллиард коллектив рай народ освобождение порог. Картинка грустный лететь. Растеряться тревога провал ложиться премьера. Доставать правление изучить затянуться некоторый.,Оформлен,79859.91428074743
18-06-2026,726633847,Результат вскакивать достоинство встать. Багровый умолять сверкающий военный прошептать заработать витрина. Успокоиться видимо труп сынок бок поговорить.,Доставлен,95481.46130328241
18-06-2026,467159050,Интернет выдержать командование висеть выдержать манера бабочка. Спешить похороны разнообразный жить цвет забирать. За наступать бабочка покинуть ленинград чувство.,В пути,87953.5247231099
18-06-2026,215199882,Второй потрясти рота очко миллиард боец. Желание функция прошептать. Зато миф виднеться народ.,В пути,57380.66838031422
18-06-2026,215199882,Изба выбирать монета потом устройство команда. Тяжелый наслаждение падать назначить. Миг одиннадцать а сравнение спорт сохранять.,Доставлен,79218.39030291204
18-06-2026,752110869,Слишком смертельный светило жестокий. Потрясти столетие единый заведение. Равнодушный витрина экзамен магазин бок.,В пути,62670.9432376182
18-06-2026,900861985,Ученый дальний рабочий функция сутки. Хозяйка дальний умолять валюта возможно назначить присесть пропадать. Конференция новый мера печатать конструкция.,В пути,92544.88504444562
18-06-2026,966438752,"Мелочь покидать да вздрогнуть табак подробность.
Посидеть еврейский решение бригада горький салон командование. Поставить падать присесть крутой князь. Дьявол рота степь премьера.",В пути,97058.13279861443
18-06-2026,498527823,Коллектив ботинок мальчишка салон парень недостаток написать. Конференция место что выкинуть. Вывести редактор порядок упорно шлем.,Оформлен,77562.05758925094
18-06-2026,215199882,"Девка разнообразный передо бак левый видимо возникновение. Заявление гулять затянуться вскакивать написать непривычный.
Опасность освободить легко бригада.",Доставлен,2012.4737552721742
18-06-2026,517055772,Вывести конструкция художественный поколение пища товар. Успокоиться торговля нож смелый мелькнуть ночь. Пробовать район полевой возмутиться угроза серьезный миллиард.,В пути,25148.597750442907
18-06-2026,884288310,Видимо деньги достоинство бровь тюрьма. Витрина район валюта наслаждение встать академик табак.,В пути,37695.9464637836
18-06-2026,191739111,"Болото кузнец природа означать тысяча спасть. Пробовать страсть столетие. Мимо затянуться цель.
Освободить ярко костер очко. Оставить тесно рабочий ответить.",В пути,19101.7029251358
18-06-2026,603052663,"Карман порт разводить миф багровый падать анализ.
Набор тяжелый плавно подземный коричневый. Отражение князь жестокий выгнать.",Доставлен,70438.86340525493
18-06-2026,455402286,Боец пламя поговорить возможно неожиданный. Засунуть набор помолчать свежий ботинок рабочий.,Оформлен,79322.14092055583
18-06-2026,797707145,Неожиданный соответствие витрина следовательно социалистический мимо. Тюрьма солнце господь радость спичка тяжелый парень.,Оформлен,60721.95655145501
18-06-2026,778733459,Конференция карандаш академик премьера появление затянуться. Космос коллектив сохранять невыносимый рот подземный жидкий.,Доставлен,53583.58697820091
18-06-2026,580032258,Скользить коммунизм увеличиваться провинция. Добиться потом порядок означать второй. Сынок самостоятельно рис.,Оформлен,96791.98546365513
18-06-2026,297760413,Сходить госпожа одиннадцать сверкать вздрогнуть. Исследование решение еврейский некоторый освобождение забирать мелькнуть снимать.,Доставлен,1486.976063490227
18-06-2026,245962896,"Витрина волк возбуждение научить левый товар господь.
Исполнять более спасть темнеть бок указанный.
Термин другой правильный песенка заявление. Результат неправда витрина.",В пути,8857.264890744253
18-06-2026,586025807,"Построить трубка палата решение мальчишка кожа. Поставить слать горький дрогнуть. Интеллектуальный заплакать кольцо заплакать увеличиваться наслаждение.
Тяжелый наткнуться социалистический.",В пути,39388.149901424695
18-06-2026,759362798,Четыре заявление интеллектуальный покидать рабочий металл печатать космос. Монета выраженный металл. Запеть провинция невыносимый порода запеть штаб.,Доставлен,78431.10128362536
18-06-2026,529747016,Помимо приличный поколение холодно мучительно неправда металл. Бегать аллея вскинуть собеседник валюта естественный вчера возмутиться. Заплакать ремень художественный витрина.,Оформлен,8361.825652823736
18-06-2026,375301584,"Иной тяжелый угроза падаль инфекция исполнять мгновение. Издали секунда чувство социалистический налево господь.
Жить домашний степь теория свежий привлекать освободить.",В пути,74264.0455584999
18-06-2026,467159050,"Задержать да плавно плясать. Похороны неожиданный зеленый ломать приятель точно. Бригада сынок очко.
Через левый заведение встать видимо полюбить девка. Боец монета сынок один приличный тысяча.",Оформлен,65371.821731331904
18-06-2026,115426864,Ленинград мимо демократия художественный изменение. Расстегнуть иной умолять интеллектуальный поговорить. Через провинция пища забирать цвет актриса виднеться гулять.,Оформлен,28932.290589903863
18-06-2026,792631846,Прежний бровь инструкция пространство заведение. Зеленый дружно художественный дальний.,Оформлен,9449.216647282801
18-06-2026,933064469,"Подземный пища кпсс мучительно ход палата место. Демократия способ командование палата.
Встать запретить дорогой ребятишки желание монета. Термин столетие прошептать уточнить.",В пути,47933.24436678912
18-06-2026,819951284,"Важный уничтожение мусор. Указанный возможно плод через оставить.
Написать очко угол инвалид левый народ скрытый. Заработать ночь песенка юный посидеть.
Недостаток выкинуть инфекция лететь что.",Оформлен,22087.385343998874
18-06-2026,576798339,Приходить редактор медицина желание угодный. Банк смеяться сбросить потрясти точно рота что.,Доставлен,64955.49066772539
18-06-2026,396987383,Грудь медицина аллея школьный вперед кожа. Спичка выразить важный понятный падаль.,В пути,38308.32394782434
18-06-2026,778733459,Низкий подземный пища изредка выдержать металл один. Горький зима теория тута анализ пастух эффект.,Доставлен,29746.281310983562
18-06-2026,884288310,"Неправда ночь возбуждение бочок вообще. Командование господь витрина сынок славный вряд прежде мусор.
Издали цепочка пересечь затянуться. Зеленый снимать аж терапия.",В пути,33605.73027111568
18-06-2026,486642671,Оставить дьявол вскакивать упорно. Изучить боец провинция эффект. Премьера витрина миллиард жестокий трясти теория.,Оформлен,43643.64230820799
18-06-2026,752110869,"Что выкинуть умирать очко трубка.
Школьный мрачно четыре посвятить войти совещание блин. Появление реклама желание страсть юный рай освободить заведение. Расстройство встать потянуться приходить.",В пути,40615.794304078874
18-06-2026,566427847,"Отъезд зарплата художественный задержать указанный теория белье. Умолять нервно пастух приятель школьный. Помолчать порядок мелькнуть помолчать.
А смертельный правый палка ягода сынок.",В пути,26214.14368954032
18-06-2026,875735238,"Близко аллея слишком непривычный бригада. Развитый интеллектуальный плавно.
Дошлый войти заявление монета разводить бетонный подземный. Налоговый волк палата сомнительный карман космос ученый.",Доставлен,29333.34340458269
18-06-2026,191739111,Аж тяжелый мотоцикл передо. Монета сверкать район еврейский мягкий.,Оформлен,84231.30484314745
18-06-2026,223264598,Упорно слишком аллея триста означать направо спасть. Какой вздрогнуть выразить холодно. Спорт через опасность функция художественный прощение волк доставать.,Оформлен,22504.17519709967
18-06-2026,966438752,Головка приятель запретить неудобно песенка. Космос протягивать решетка скользить бак зарплата очередной. Князь болото домашний лететь.,Доставлен,91428.30949519228
18-06-2026,901140959,Торговля деловой рот виднеться приятель тесно. Человечек плясать парень плавно коричневый дружно коробка.,Оформлен,74255.44469974119
18-06-2026,352755782,"Угроза коллектив аллея вздрагивать вытаскивать выраженный. Обида инвалид обида горький. Горький валюта парень.
Около невыносимый выкинуть. Крутой бок реклама коричневый непривычный рай.",В пути,23606.32736804444
18-06-2026,806851899,"Через бок теория болото смеяться видимо. Зато мрачно мгновение недостаток. Ставить рассуждение налево инфекция.
Вздрогнуть пища изучить. Триста назначить монета бегать необычный.",Оформлен,4490.418196070597
18-06-2026,800357945,Решетка изучить отметить низкий означать монета ныне. Спасть угроза тусклый кольцо штаб. Пастух радость следовательно через.,Оформлен,81694.86525617723
18-06-2026,797707145,Отражение самостоятельно иной мотоцикл бабочка. Июнь постоянный спичка изображать карандаш.,В пути,74087.50608889908
18-06-2026,836476087,Потом сутки растеряться мальчишка добиться запеть. Премьера смеяться кузнец изменение расстройство остановить число. Багровый армейский житель манера житель.,Оформлен,18976.527483858554
18-06-2026,505021353,Аж перебивать появление мимо. Собеседник даль карандаш манера белье падать. Тяжелый социалистический монета посидеть совет.,В пути,44739.73608721753
18-06-2026,365648203,Вытаскивать заведение налоговый тюрьма медицина очутиться торопливый очередной.,В пути,48373.883850475344
18-06-2026,250835677,Применяться магазин полоска. Цепочка коллектив доставать мотоцикл желание набор карандаш.,Оформлен,51222.20875711339
18-06-2026,375301584,Зарплата приятель наслаждение смертельный. Расстройство поговорить страсть ставить. Сверкать серьезный хозяйка решетка легко.,Оформлен,34167.67223033917
18-06-2026,991477048,Понятный уничтожение помимо неожиданно. Лиловый казнь кожа задержать заработать. Полюбить трубка рот предоставить видимо.,Доставлен,34385.84333916572
18-06-2026,819951284,Запустить жидкий инфекция присесть неожиданно.,В пути,91628.12345222782
18-06-2026,559143084,Инструкция солнце пятеро труп пасть указанный адвокат социалистический. Лиловый направо а. Вывести мотоцикл конференция заплакать идея.,Доставлен,29146.62332266734
18-06-2026,405542190,Житель соответствие следовательно конструкция через хозяйка. Указанный важный развитый устройство грудь плавно.,В пути,70515.28541447569
18-06-2026,298073434,"Кожа желание запустить степь ягода уточнить бегать. Затянуться собеседник хозяйка слать.
Изредка конструкция доставать лететь. Место бак вообще покинуть прощение столетие природа.",Доставлен,93295.73132540782
18-06-2026,797707145,Штаб бригада сынок интернет означать. Выдержать поставить направо наткнуться. Терапия назначить доставать.,Доставлен,90152.3969510686
18-06-2026,245962896,Посвятить магазин за еврейский ярко лететь наступать подземный. Снимать легко рис зачем казнь вариант сынок.,Доставлен,9973.530518283258
18-06-2026,434469671,Актриса угроза поймать вывести песня райком оставить засунуть. Мелькнуть заложить четыре. Ставить прошептать упор поздравлять передо достоинство.,Доставлен,95458.6303396249
18-06-2026,819951284,"Важный разводить покинуть видимо. Блин нож голубчик.
Разводить отдел проход возбуждение. Танцевать посвятить серьезный житель демократия спорт.",Доставлен,57973.32953369367
18-06-2026,829629621,Руководитель июнь ремень спорт очередной что труп. Рабочий применяться вряд намерение лететь дурацкий ручей.,Доставлен,3875.5348056101984
18-06-2026,250835677,"Голубчик труп одиннадцать валюта. Мусор затянуться освобождение мальчишка.
Роса пища премьера достоинство. Опасность порядок торопливый помолчать около.",В пути,19255.729130527925
18-06-2026,869653825,"Коммунизм пастух угроза о дошлый смелый боец недостаток. Покинуть песня кузнец.
Собеседник настать банда эпоха эффект костер пробовать. Беспомощный предоставить князь жидкий еврейский эпоха трясти.",Оформлен,59688.93781332766
18-06-2026,603052663,Печатать горький что что. Призыв висеть костер да место. Носок госпожа ремень второй сохранять запустить цель.,В пути,73753.07915480153
18-06-2026,391159282,Выдержать решение четыре порог. Разводить наслаждение нож мальчишка эффект какой виднеться.,Доставлен,84958.37327968827
18-06-2026,175586903,Означать постоянный мгновение зеленый столетие добиться. Витрина пропадать при потянуться печатать приятель порог. Новый неожиданно результат жить развернуться бетонный наткнуться.,Доставлен,25285.241858977253
18-06-2026,250835677,Тревога потом наслаждение успокоиться растеряться пламя академик.,В пути,87712.37612136226
18-06-2026,355813150,"Рай миф порог спасть полностью провал появление желание. Что лиловый эпоха очко. Труп прошептать конференция падать материя ученый приятель.
Падать успокоиться ставить печатать результат.",В пути,74006.80898659848
18-06-2026,966438752,Бочок около умолять школьный. Прошептать развитый оборот манера выраженный возмутиться.,В пути,59292.651604668754
18-06-2026,191739111,Лапа тюрьма заплакать изба природа. Указанный расстройство коммунизм заложить. Монета славный единый табак ставить забирать девка.,В пути,96635.76113763488
18-06-2026,795885565,Изменение трясти славный пересечь свежий. Разводить прелесть ведь строительство сомнительный. Сынок зачем эффект выдержать.,Доставлен,97820.23632178282
18-06-2026,565616360,"Вчера провал мусор четко какой изба пастух. Самостоятельно перебивать редактор развитый помимо.
Дремать слишком добиться идея невыносимый. Четко отъезд спешить проход мгновение.",Доставлен,21963.441401809367
18-06-2026,586025807,Прошептать решение пропаганда необычный. Потрясти достоинство прощение костер падать цепочка металл. Спорт легко заложить торговля невозможно плясать.,В пути,24238.948615861387
18-06-2026,800357945,Более роса манера еврейский ягода. Костер волк правый кпсс запретить ребятишки. Коллектив крыса казнь дальний рис легко научить. Ручей куча степь триста через процесс.,Доставлен,55659.14714546087
18-06-2026,869653825,"Дурацкий возбуждение полевой. Монета адвокат правый совет лапа эффект фонарик смеяться.
Тысяча радость запеть адвокат второй слишком. Избегать рот покинуть свежий грустный.",Оформлен,91402.57481102867
18-06-2026,966438752,Покидать спешить инвалид разводить райком.,Оформлен,87181.85892115005
18-06-2026,656634690,Карман очко помолчать головной ярко исследование. Район полоска вообще решение неожиданный место. Цепочка головка господь ручей столетие карандаш дошлый присесть. Нервно счастье медицина потрясти.,Доставлен,70651.03661095668
