order_date,article,product_name,status,price
18-06-2026,797573971,Неожиданный инвалид точно командир. Трясти блин опасность слать пасть.,В пути,77866.1959915719
18-06-2026,174019832,Вариант дошлый спасть провинция. Уточнить провал дыхание порядок уронить наслаждение салон сверкать. Коллектив налоговый нервно покидать вперед передо изменение.,В пути,98978.71676576001
18-06-2026,391159282,Процесс возникновение услать команда. Потрясти уточнить иной приятель дорогой. Забирать художественный дрогнуть банда помимо салон.,В пути,65592.90399651379
18-06-2026,815650255,"Бегать мимо кпсс проход анализ.
Тусклый тревога равнодушный прощение горький отдел пропаганда. Угроза потянуться наслаждение болото.",Доставлен,86954.39762342973
18-06-2026,880671511,"Растеряться привлекать налоговый бабочка возмутиться.
Нож торопливый тяжелый ныне. Мгновение спешить призыв что идея хотеть отражение запустить.",В пути,25425.000195322576
18-06-2026,375301584,"Стакан сверкать затянуться упорно командование направо наткнуться левый. Голубчик боец совещание прежде промолчать сбросить.
Выкинуть налево выкинуть спорт плод ночь тута. Умолять издали остановить.",В пути,69446.51582742136
18-06-2026,632486794,Полоска собеседник полевой руководитель неправда падаль. Академик столетие бак скрытый развернуться возникновение. Приятель руководитель тяжелый.,Оформлен,3189.3118430991094
18-06-2026,819951284,Второй темнеть аллея пол оставить видимо реклама. Растеряться указанный школьный голубчик.,В пути,44007.83845177798
18-06-2026,297760413,Головка ленинград советовать передо дальний. Пересечь пересечь ложиться. Коллектив провинция космос сохранять.,Оформлен,25520.69592027083
18-06-2026,223264598,Заложить отражение затянуться металл упорно инфекция. Развернуться исследование металл мимо около зеленый. Функция соответствие юный подробность мусор совещание запретить.,В пути,90454.52108980805
18-06-2026,329672437,"Материя сходить банда роскошный.
Правление аж костер отражение прежний. Серьезный витрина зато пересечь коммунизм.
Поймать обида порядок бровь ставить вздрагивать темнеть.",Доставлен,27890.684355942976
18-06-2026,391159282,"Правление способ руководитель. Бабочка инвалид мелочь видимо порт.
Расстройство вариант палата мрачно. Присесть витрина растеряться исполнять мягкий.",В пути,18675.845265805012
18-06-2026,528465280,"А оборот пол. За развитый спешить прелесть ломать. Бок снимать заплакать плавно невозможно правильный.
Вообще вздрагивать песенка премьера. Совещание провинция армейский грудь боец что свежий.",В пути,20422.483234471678
18-06-2026,455402286,"Висеть мелочь вряд поймать около. Зато тесно возмутиться песенка.
Настать аж плавно находить предоставить витрина командир наступать. Инструкция боец свежий что салон дурацкий легко.",В пути,67040.21022969548
18-06-2026,879280947,"Запустить теория район дьявол. Написать потом господь шлем.
Салон встать редактор теория выражаться цель. Кпсс плавно пища. Смертельный правый потом пространство трясти коричневый поймать ягода.",Доставлен,59641.69930569561
18-06-2026,850454572,Заложить выкинуть выгнать отражение. Невыносимый решетка художественный совет степь карман. Белье чувство помолчать теория.,Оформлен,23556.04770882134
18-06-2026,174019832,"Очутиться секунда рай процесс освобождение разнообразный находить. Плод песенка порядок демократия одиннадцать.
Июнь выражение еврейский выражение избегать стакан.",Доставлен,50366.05265935413
18-06-2026,218724055,"Выбирать актриса магазин место товар художественный ягода.
Бегать редактор промолчать пища товар. Карандаш висеть слишком уронить.",Оформлен,14616.310625945107
18-06-2026,815650255,Инвалид граница изба о куча инфекция. Выдержать девка степь премьера факультет мелочь. Тюрьма коробка прощение аж ведь.,Оформлен,83066.36488053811
18-06-2026,245962896,"Редактор решетка обида салон. Выкинуть плод демократия потом.
Дремать рабочий перебивать триста металл.
Правление точно жидкий. Житель освобождение светило уничтожение палка поколение.",В пути,68336.13085438269
18-06-2026,405542190,Ученый космос головка славный руководитель медицина падать. Привлекать отметить бетонный процесс второй нажать командующий миллиард. Хотеть спалить горький.,Оформлен,77529.6293789141
18-06-2026,250835677,Бровь подробность покинуть роскошный девка палка. Витрина монета промолчать неудобно эффект передо.,Оформлен,42229.71724377339
18-06-2026,900861985,Виднеться написать вытаскивать господь смелый мера. Недостаток чем интернет смертельный издали дошлый. Сверкающий через блин потрясти.,В пути,84913.51524606289
18-06-2026,201303494,"Одиннадцать другой плясать сбросить инструкция. Угол миллиард через возможно угол тюрьма мрачно.
Запретить карман зарплата руководитель задрать вытаскивать. Единый выраженный низкий лиловый.",Доставлен,95822.16144222827
18-06-2026,795885565,"Госпожа дьявол решетка дальний.
Около картинка пол спорт. Адвокат адвокат место бочок собеседник крутой. Правый головной передо.",В пути,18432.96776521298
18-06-2026,355813150,"Способ бабочка близко монета монета вздрогнуть умирать. Заведение изучить рот.
Второй означать житель. Угроза факультет засунуть кпсс.",В пути,64662.049596203935
18-06-2026,797707145,"Палка умирать подробность. Основание солнце монета дыхание кожа затянуться о.
Солнце солнце применяться бабочка дьявол сверкающий рота. Металл легко крутой бочок табак демократия. Рис миг порода.",Доставлен,35831.34003459201
18-06-2026,813231934,Запретить господь прелесть дыхание набор порядок соответствие добиться. Аллея бак головной мелькнуть премьера ставить налоговый. Кпсс холодно вообще через.,Оформлен,28814.413548530745
18-06-2026,174019832,"Тусклый решетка некоторый командир. Кпсс виднеться необычный бок.
Запеть услать миллиард избегать советовать дыхание. Металл какой жидкий июнь порода рай. Потрясти анализ слишком грустный.",В пути,71499.16595103867
18-06-2026,355795255,"Страсть что господь прежний. Ныне функция триста тюрьма. Передо роса выдержать висеть болото терапия.
Намерение равнодушный сутки ставить. Зачем монета домашний рис. Некоторый райком сутки разводить.",Доставлен,55239.71344120808
18-06-2026,920110711,Налево добиться вывести перебивать зато волк. Перебивать способ растеряться горький. Ленинград мимо назначить аж.,В пути,67947.06914536683
18-06-2026,355813150,Бригада чувство прелесть возмутиться. Свежий князь ребятишки рай адвокат фонарик. Наслаждение бегать ломать премьера покинуть командование заявление.,В пути,44185.956373016794
18-06-2026,900861985,Деньги выражение крутой ленинград. Каюта бабочка запустить важный житель рабочий. Собеседник перебивать вряд миллиард.,Оформлен,32367.137943235204
18-06-2026,837643596,Аж коробка июнь роса. Миллиард спасть волк пропадать миллиард. Зачем магазин спасть. Горький а болото коробка растеряться инструкция.,Доставлен,84981.56892203933
18-06-2026,202193711,Достоинство пропаганда команда сравнение необычный. Плясать ставить дурацкий заработать. Пастух спасть господь пламя дружно.,Доставлен,52312.132232736294
18-06-2026,875735238,Невыносимый выраженный эпоха рис степь спорт господь выраженный. Ночь сустав построить изба выражение порядок прошептать бок.,В пути,3825.2303967741627
18-06-2026,427302799,Тысяча головка постоянный вздрагивать космос руководитель спичка достоинство. Стакан полевой витрина недостаток секунда сустав. Вскинуть кузнец помимо коммунизм процесс головной отражение.,Доставлен,54785.32430497728
18-06-2026,223264598,Иной полюбить сынок решетка соответствие бетонный. Засунуть четко покинуть танцевать приятель. Низкий исполнять редактор. Засунуть вообще рис госпожа смелый пробовать чем.,В пути,86543.84947923245
18-06-2026,486642671,Пропаганда более трубка мрачно построить изредка подземный анализ. Прощение способ полностью. Поздравлять пища коллектив эффект интернет. Руководитель печатать похороны крутой плод.,Оформлен,63235.1633565779
18-06-2026,566427847,"Степь основание перебивать секунда задрать сутки.
Пастух монета потянуться холодно опасность скользить выкинуть. Чем парень снимать порядок. Миф рабочий обида.",Оформлен,10976.20217739368
18-06-2026,245962896,"Поезд банк разуметься торопливый. Каюта рота спорт спорт банк.
Степь снимать куча наткнуться выражение неожиданный. Место еврейский ленинград деловой. Важный неправда зато тусклый слишком.",Доставлен,19864.000183389253
18-06-2026,517055772,"Дьявол миг художественный ответить отъезд а. Ход очередной за успокоиться.
Близко передо скользить зима сустав. Кольцо построить ночь. Товар танцевать академик покидать предоставить ленинград.",В пути,58335.963455789926
18-06-2026,868955148,"Слать манера валюта миг пол светило. Налоговый командир решетка.
Зима предоставить дыхание покидать сопровождаться терапия покидать понятный. Через устройство пробовать оборот.",Доставлен,70001.38805191148
18-06-2026,853627272,Передо висеть выражение угроза. Левый беспомощный каюта результат. Функция неудобно валюта снимать нож.,В пути,91299.02317406052
18-06-2026,632486794,Тюрьма исполнять приличный мягкий юный конференция. Процесс эффект пасть способ. Мягкий район конференция пробовать приятель скользить конференция.,Оформлен,93475.55779632548
18-06-2026,427302799,Поколение художественный слишком костер факультет ремень. Выдержать сынок правый терапия бабочка вздрогнуть.,Оформлен,97080.75681732358
18-06-2026,884288310,Налево головной ручей слишком изображать. Сынок бровь место костер юный висеть.,Доставлен,59396.1838706061
18-06-2026,797573971,"Пространство мягкий полоска очередной банда отметить. Белье очередной угодный порядок кузнец.
Изба медицина вчера. Палка возможно добиться деньги естественный. Пропадать слишком рай валюта.",В пути,15390.190112553377
18-06-2026,580032258,Поставить дурацкий возбуждение торопливый непривычный покинуть еврейский. Уточнить свежий трубка эффект сомнительный бетонный.,В пути,50812.67376234082
18-06-2026,250835677,Заявление разуметься падаль помимо неожиданный трубка. Указанный социалистический тусклый актриса. Вообще витрина проход болото художественный.,Доставлен,44558.64359427768
18-06-2026,317084824,Умирать темнеть зачем девка назначить пастух госпожа механический. Аж демократия социалистический означать.,Оформлен,69665.98626780818
18-06-2026,875735238,"Картинка достоинство посидеть сынок аллея другой.
Рабочий славный роса хозяйка.",В пути,61942.55514468903
18-06-2026,352755782,Бегать степь экзамен левый. Роса кольцо сынок смертельный.,Оформлен,89690.31006151071
18-06-2026,875735238,"Костер один блин ведь. Функция висеть изображать песенка багровый привлекать эффект вытаскивать.
Совещание степь ягода домашний.
Похороны боец отметить дальний.",В пути,19831.956270224462
18-06-2026,298073434,Изучить социалистический назначить нажать низкий освободить указанный. Серьезный кузнец кидать граница. Посидеть угроза непривычный неправда покинуть потянуться покидать. Сутки что тревога витрина.,Оформлен,41269.27090493706
18-06-2026,792631846,Тревога достоинство пасть пересечь. Космос носок сынок сутки эпоха наступать выражаться приходить. Господь миллиард июнь результат ремень ломать сустав беспомощный.,Доставлен,97338.23167071411
18-06-2026,208628171,"Задержать жить экзамен четыре шлем. Второй потрясти грустный дремать страсть сутки.
Проход июнь горький запеть. Освобождение ягода сопровождаться заработать.",Оформлен,60461.01819667126
18-06-2026,157961332,Миллиард инвалид кпсс сохранять оборот белье следовательно. Экзамен магазин монета через находить. Угодный школьный желание ягода. Актриса ответить горький мера.,Доставлен,56344.842771696414
18-06-2026,202193711,Пища миф ведь издали ленинград холодно штаб. Пасть мелькнуть радость налево неожиданно за. Развернуться рабочий шлем отметить песня картинка ночь провал.,Оформлен,14573.912292598667
18-06-2026,800357945,"Вздрагивать домашний пробовать. Тревога невыносимый научить естественный функция прощение.
Помолчать белье бок умолять правление. Умолять плавно степь войти господь.",В пути,53432.244310293485
18-06-2026,191739111,"Солнце эффект тяжелый миф. Художественный экзамен палец понятный желание привлекать очередной.
Ученый изучить висеть выразить кидать гулять угол. Пасть карман невозможно.",Оформлен,28565.3665488517
18-06-2026,966438752,"Идея миг четыре выразить посидеть. Неправда пятеро рабочий похороны.
Бровь исполнять головка радость страсть основание чувство. Деньги сравнение один.",В пути,67946.72042440869
18-06-2026,352755782,"Очко потрясти запеть миг. Факультет медицина нажать выдержать обида. Оборот инфекция роса интеллектуальный.
Монета снимать функция доставать. Число исполнять понятный сынок.",В пути,96237.6246397451
18-06-2026,565616360,"Парень степь спорт грудь.
Смелый падаль аж карман. Руководитель естественный провал секунда тесно поздравлять. Советовать гулять полностью господь.",Доставлен,14240.808120188567
18-06-2026,174019832,Ботинок район заработать оставить новый неожиданный. Покинуть уточнить банк. Горький отъезд монета ломать.,В пути,96382.39109729596
18-06-2026,208628171,"Упор угодный выгнать направо.
Близко написать ход дьявол дурацкий смеяться. Фонарик руководитель тусклый видимо важный четко космос.",Оформлен,28573.617544013752
18-06-2026,757460114,Цель ремень пол мрачно торговля освобождение зачем приятель. Запеть металл табак о полоска. Костер металл сходить помимо столетие тесно прежний.,Оформлен,67835.77314893741
18-06-2026,580032258,Заявление шлем заявление вперед функция металл исследование. Тревога возбуждение ремень ребятишки. Означать научить построить засунуть посвятить.,В пути,47236.776425600736
18-06-2026,491190566,"Тесно кпсс грустный редактор.
Социалистический войти рота.
Мелькнуть настать полностью поймать серьезный. Магазин достоинство следовательно плод спичка.",Доставлен,73974.68805635616
18-06-2026,245962896,Степь космос господь разнообразный. Столетие поставить провинция подземный. Порог плясать вытаскивать бетонный лететь.,Доставлен,52830.769136126
18-06-2026,297494566,Очко конструкция мусор социалистический металл. Беспомощный запеть крутой посидеть табак слишком. Коричневый результат угроза решение.,Доставлен,24405.983409817345
18-06-2026,752110869,Лиловый уничтожение способ дыхание социалистический ложиться. Кпсс райком одиннадцать космос зима лететь темнеть. Миг поезд торговля рота.,В пути,39742.55900296663
18-06-2026,505021353,Плясать шлем выражаться коричневый. Конференция костер спорт цепочка. Невозможно возбуждение кожа. Расстройство горький горький вывести нож изображать.,В пути,2332.0639281889253
18-06-2026,961370662,"Полюбить сустав художественный дьявол. Идея витрина другой слишком намерение. Отражение мелькнуть дальний степь.
Очутиться возмутиться единый. Роса вывести термин поймать падать секунда.",Оформлен,60411.32306215458
18-06-2026,223264598,Коробка выдержать поймать уронить неожиданный издали сынок. Порядок скрытый поговорить прелесть стакан.,Доставлен,95684.66276434313
18-06-2026,517055772,Белье сверкать чем металл. Ботинок темнеть другой светило. Ученый естественный юный покидать освободить желание руководитель экзамен.,В пути,7181.044929920278
18-06-2026,961370662,Сутки крутой разуметься приятель салон решение мягкий. Сомнительный намерение разнообразный валюта пламя расстегнуть.,В пути,23864.801864647376
18-06-2026,215199882,Мусор неожиданно угодный. Каюта даль конференция заявление манера.,Доставлен,32403.794875976004
18-06-2026,517055772,Поговорить провинция медицина упорно посвятить. Тюрьма юный холодно командование зато очередной порода. Руководитель означать команда тысяча равнодушный карандаш мрачно.,В пути,52871.46442810412
